### ISSUE TITLE
-X community feed becomes offline after a few hours while TCP connection remains ESTABLISHED and data is still being sent

### ISSUE THREAD

**Issue by ronan-fontenay** [jvde-github/AIS-catcher#635]
# `-X` community feed goes offline after a few hours while TCP connection remains established and data is still being sent

## Description

I am running AIS-catcher continuously on a Raspberry Pi 3 with a Buildroot-based OS.

The local AIS receiver continues to work correctly, including the local web interface and other output feeds, but the station on aiscatcher.org becomes **Offline after a few hours**. 

I let the system in this state as it might be helpful for diagnostic. 

<img width="741" height="565" alt="Image" src="https://github.com/user-attachments/assets/6258963f-a6d1-4c6d-b796-71f2fc9804e7" />

Restarting AIS-catcher immediately brings the station back Online.

The interesting part is that, when the station is shown as Offline:

- the AIS-catcher process is still running;
- the local web interface is still working;
- AIS reception is still working;
- MarineTraffic continues to receive data;
- VesselFinder continues to receive data;
- the TCP connection to `srv1.aiscatcher.org:4242` remains `ESTABLISHED`;
- and, as confirmed with `tcpdump`, AIS-catcher continues to send application data to the server.

Restarting AIS-catcher closes the existing TCP session and creates a new one, after which the station immediately becomes Online again.

---

## Hardware / OS

- Raspberry Pi 3
- Buildroot-based OS
- Ethernet connection
- AIS-catcher running as root
- Local web interface enabled

---

## AIS-catcher version

```text
AIS-catcher (build Aug 6 2026) v0.00-1-unknown
```

The binary was built on August 6, 2026.

---

## Command line

The process is started with:

```text
/usr/bin/AIS-catcher \
  -N 10110 \
  -u listener.marinetraffic.com XXXXX \
  -u ais.vesselfinder.com XXXXX \
  -X <REDACTED>
```

The sharing key has been deliberately redacted from this issue.

`-N 10110` provides the local web interface.

MarineTraffic and VesselFinder continue to work normally when the aiscatcher.org station goes offline.

---

## Failure state

When the station is displayed as **Offline** on aiscatcher.org, the AIS-catcher process is still running normally.

For example:

```text
# ps aux | grep ais
196 root     /usr/bin/AIS-catcher -N 10110 -u listener.marinetraffic.com XXXXX -u ais.vesselfinder.com XXXXX -X <REDACTED>
360 root     grep ais
```

The local web interface is still accessible and showing ships.

The other external feeds also continue to work.

At the same time:

```text
# netstat
Active Internet connections (w/o servers)
Proto Recv-Q Send-Q Local Address           Foreign Address         State
tcp        0      0 192.168.1.51:45690      srv1.aiscatcher.org:4242 ESTABLISHED
```

So the TCP connection to the community server has **not** been disconnected.

---

## aiscatcher.org status

The station page shows the station as:

- **Status:** Not Connected
- **Last seen:** no longer updating
- **Messages:** stop increasing

The attached screenshot shows the station in this state.

Despite this server-side status, AIS-catcher continues running locally and the other outputs remain operational.

---

## tcpdump capture while the station was Offline

I installed `tcpdump` and captured the traffic while the station was already showing **Offline** on aiscatcher.org.

Command:

```bash
tcpdump -i eth0 -nn -c 30 host srv1.aiscatcher.org and port 4242
```

The capture showed repeated application-data packets from the Raspberry Pi to the server.

```text
# tcpdump -i eth0 -nn -c 30 host srv1.aiscatcher.org and port 4242
tcpdump: verbose output suppressed, use -v[v]... for full protocol decode
listening on eth0, link-type EN10MB (Ethernet), snapshot length 262144 bytes
19:13:35.554384 IP 192.168.1.51.45690 > 185.77.96.227.4242: Flags [P.], seq 2398218495:2398218534, ack 1349146127, win 502, options [nop,nop,TS val 396769893 ecr 183726112], length 39
19:13:35.579613 IP 185.77.96.227.4242 > 192.168.1.51.45690: Flags [.], ack 39, win 509, options [nop,nop,TS val 183726881 ecr 396769893], length 0
19:13:35.891283 IP 192.168.1.51.45690 > 185.77.96.227.4242: Flags [P.], seq 39:78, ack 1, win 502, options [nop,nop,TS val 396770230 ecr 183726881], length 39
19:13:35.916663 IP 185.77.96.227.4242 > 192.168.1.51.45690: Flags [.], ack 78, win 509, options [nop,nop,TS val 183727218 ecr 396770230], length 0
19:13:38.022751 IP 192.168.1.51.45690 > 185.77.96.227.4242: Flags [P.], seq 78:117, ack 1, win 502, options [nop,nop,TS val 396772361 ecr 183727218], length 39
19:13:38.025167 IP 192.168.1.51.45690 > 185.77.96.227.4242: Flags [P.], seq 117:156, ack 1, win 502, options [nop,nop,TS val 396772364 ecr 183727218], length 39
19:13:38.047716 IP 185.77.96.227.4242 > 192.168.1.51.45690: Flags [.], ack 117, win 509, options [nop,nop,TS val 183729349 ecr 396772361], length 0
19:13:38.049907 IP 185.77.96.227.4242 > 192.168.1.51.45690: Flags [.], ack 156, win 509, options [nop,nop,TS val 183729351 ecr 396772364], length 0
19:13:38.279607 IP 192.168.1.51.45690 > 185.77.96.227.4242: Flags [P.], seq 156:195, ack 1, win 502, options [nop,nop,TS val 396772618 ecr 183729351], length 39
19:13:38.304918 IP 185.77.96.227.4242 > 192.168.1.51.45690: Flags [.], ack 195, win 509, options [nop,nop,TS val 183729606 ecr 396772618], length 0
19:13:39.392440 IP 192.168.1.51.45690 > 185.77.96.227.4242: Flags [P.], seq 195:234, ack 1, win 502, options [nop,nop,TS val 396773731 ecr 183729606], length 39
19:13:39.417735 IP 185.77.96.227.4242 > 192.168.1.51.45690: Flags [.], ack 234, win 509, options [nop,nop,TS val 183730719 ecr 396773731], length 0
19:13:40.070893 IP 192.168.1.51.45690 > 185.77.96.227.4242: Flags [P.], seq 234:273, ack 1, win 502, options [nop,nop,TS val 396774409 ecr 183730719], length 39
19:13:40.096057 IP 185.77.96.227.4242 > 192.168.1.51.45690: Flags [.], ack 273, win 509, options [nop,nop,TS val 183731397 ecr 396774409], length 0
19:13:41.100528 IP 192.168.1.51.45690 > 185.77.96.227.4242: Flags [P.], seq 273:312, ack 1, win 502, options [nop,nop,TS val 396775439 ecr 183731397], length 39
19:13:41.125285 IP 185.77.96.227.4242 > 192.168.1.51.45690: Flags [.], ack 312, win 509, options [nop,nop,TS val 183732426 ecr 396775439], length 0
19:13:41.186752 IP 192.168.1.51.45690 > 185.77.96.227.4242: Flags [P.], seq 312:351, ack 1, win 502, options [nop,nop,TS val 396775525 ecr 183732426], length 39
19:13:41.212041 IP 185.77.96.227.4242 > 192.168.1.51.45690: Flags [.], ack 351, win 509, options [nop,nop,TS val 183732513 ecr 396775525], length 0
19:13:41.263991 IP 192.168.1.51.45690 > 185.77.96.227.4242: Flags [P.], seq 351:390, ack 1, win 502, options [nop,nop,TS val 396775602 ecr 183732513], length 39
19:13:41.271157 IP 192.168.1.51.45690 > 185.77.96.227.4242: Flags [P.], seq 390:461, ack 1, win 502, options [nop,nop,TS val 396775610 ecr 183732513], length 71
19:13:41.288948 IP 185.77.96.227.4242 > 192.168.1.51.45690: Flags [.], ack 390, win 509, options [nop,nop,TS val 183732590 ecr 396775602], length 0
19:13:41.296084 IP 185.77.96.227.4242 > 192.168.1.51.45690: Flags [.], ack 461, win 509, options [nop,nop,TS val 183732597 ecr 396775610], length 0
19:13:43.062269 IP 192.168.1.51.45690 > 185.77.96.227.4242: Flags [P.], seq 461:500, ack 1, win 502, options [nop,nop,TS val 396777401 ecr 183732597], length 39
19:13:43.087380 IP 185.77.96.227.4242 > 192.168.1.51.45690: Flags [.], ack 500, win 509, options [nop,nop,TS val 183734388 ecr 396777401], length 0
19:13:43.569411 IP 192.168.1.51.45690 > 185.77.96.227.4242: Flags [P.], seq 500:539, ack 1, win 502, options [nop,nop,TS val 396777908 ecr 183734388], length 39
19:13:43.594328 IP 185.77.96.227.4242 > 192.168.1.51.45690: Flags [.], ack 539, win 509, options [nop,nop,TS val 183734895 ecr 396777908], length 0
19:13:43.739227 IP 192.168.1.51.45690 > 185.77.96.227.4242: Flags [P.], seq 539:578, ack 1, win 502, options [nop,nop,TS val 396778078 ecr 183734895], length 39
19:13:43.764390 IP 185.77.96.227.4242 > 192.168.1.51.45690: Flags [.], ack 578, win 509, options [nop,nop,TS val 183735065 ecr 396778078], length 0
19:13:43.913936 IP 192.168.1.51.45690 > 185.77.96.227.4242: Flags [P.], seq 578:650, ack 1, win 502, options [nop,nop,TS val 396778252 ecr 183735065], length 72
19:13:43.938964 IP 185.77.96.227.4242 > 192.168.1.51.45690: Flags [.], ack 650, win 509, options [nop,nop,TS val 183735240 ecr 396778252], length 0
30 packets captured
34 packets received by filter

```

Therefore, while the station was shown as Offline, there was still active TCP application traffic from the Pi to the aiscatcher.org server, and the server was acknowledging the transmitted data.

<img width="475" height="670" alt="Image" src="https://github.com/user-attachments/assets/da0eee69-7bc6-46fd-a9aa-4451cfce948e" />

I can provide additional debug logs, packet captures, or any other information that would help.

**Comment by jvde-github** [comment]
I had a look on my side: your feed is connecting correctly and the data is arriving. The issue is that the connection is not linked to your station, so it's treated as an anonymous feed.

Tell me if I'm wrong, but the data suggests you're running an older version (v0.63 — your startup banner shows "v0.00-1-unknown" because it's a tarball build; the build date is just the compile date). That version sends the uuid key only once, on the first message after the process starts. Everything works until the TCP connection drops — server maintenance on my side, or any network hiccup — and after the automatic reconnect the key is never sent again, which is exactly your symptom: connection ESTABLISHED, data still flowing, station offline. Restarting AIS-catcher sends the key again, which is why that brings it back. From v0.66 on, the key is included every 100 messages, precisely to deal with this: your tcpdump (with -A) should then show an occasional uuid — I don't see it in the incoming data at all.

Best way to resolve this is upgrading to the latest version (backward compatible). Meanwhile I can attach your IP to your station on the server so it shows online again?

**Comment by ronan-fontenay** [comment]
Hello, 
Thanks for the feedback. Back online with the 0.70, let's see :)

**Comment by ronan-fontenay** [comment]
I can confirm after more than 24h, problem solved. 

<img width="752" height="549" alt="Image" src="https://github.com/user-attachments/assets/bd498bb7-25c8-44cd-9a62-644e1bea1a98" />

<img width="478" height="627" alt="Image" src="https://github.com/user-attachments/assets/ff6462c1-e62d-4939-bfff-b649e70d9f3c" />

**Comment by Phil353556** [comment]
Hello @ronan-fontenay ,
Just curiosity, I read for system  "running time 20697d" means ~56 years, that's weird

**Comment by ronan-fontenay** [comment]
> Hello [@ronan-fontenay](https://github.com/ronan-fontenay) , Just curiosity, I read for system "running time 20697d" means ~56 years, that's weird

Hello,
I'm running on a raspberry pi 3 with as OS in Ram and the SD card is not used after boot. 
I suppose that ais-catcher is starting before the NTP sync is done. I should adjust the starting script :)

**Comment by Phil353556** [comment]
Thanks,
Interesting
I suppose there is a synchronization, at regular interval, to be able to start over from SD ?

**Comment by ronan-fontenay** [comment]
> Thanks, Interesting I suppose there is a synchronization, at regular interval, to be able to start over from SD ?

Not sure to get your point. The os is loaded by tftp or from the sd card, and not used after that.

**Comment by Phil353556** [comment]
Ok, sorry I wasn't clear enough.
The data are never backuped on disk?  so each time the OS starts, the data when the OS was created is loaded, no recent data, for example statistics for aiscatcher?

**Comment by ronan-fontenay** [comment]
> Ok, sorry I wasn't clear enough. The data are never backuped on disk? so each time the OS starts, the data when the OS was created is loaded, no recent data, for example statistics for aiscatcher?

Exactly, it's a feeder only, I want it robust, boot in 5sec and resist to data corruption in case of a power failure.

If I want statistics overtime, marine traffic or vessel finder that I feed are great 😃

**Comment by Phil353556** [comment]
OK, 
Thanks for your explanations,  that's an interesting use case.
